{
  "fixture": "session-end.json",
  "sourceContract": "Cursor agent hook `sessionEnd` with `reason`, `duration_ms`, and `final_status`, per cursor.com/docs/agent/hooks",
  "provider": "cursor",
  "capturedDate": "2026-07-29",
  "author": "otel-hook cursor provider owner (agent)",
  "sanitization": "Real key set, synthetic values; the duration is an invented measurement.",
  "licenseBasis": "Original authorship; only the field names and their types are taken from the published reference and the cited capture set.",
  "providerVersionObserved": "cursor 2026.07.17-3e2a980 (CLI)",
  "sha256": "98ee310aa524f82fad972fc79647bd6631c50e13e72041f36afac4c92e0a95ae",
  "notes": "sessionEnd fired in both CLI runs of colinsurprenant/director hack/canary/cursor-cli/findings and in neither IDE run, despite the same hooks.json registering it on both surfaces — the mirror image of `stop`, which fired only in the IDE. `duration_ms` is milliseconds per the reference."
}
